source,target,t5_label,t5,actual
"""multilabel classification: URL_PREFIX feature for web UI? --- Hi,  Is it possible to add a --url-prefix option for the web ui, so that proxy setups can run the web ui under a sub-url? We want to run locust proxied behind our https server, which proxies other services like @Jahaja 's ps-dash, and to do this requires any assets being loaded to be fetched either relative to ./ or full-pathed under a known prefix.  Thanks, Jeff """,feature,feature,0,0
"""multilabel classification: Make duk_hstring charlen lazy --- For most strings the character length (`.length`) is not accessed. It's currently precomputed which slows down every string intern operation. Change that behavior so that the character length is computed lazily when it is first needed.    Tasks:  - [x] Change charlen and intern handling  - [x] Test effect in practice  - [x] Because of footprint impact, maybe make lazy/strict behavior optional => follow-up  - [x] Releases entry""",performance,performance,1,1
multilabel classification: Implementation of guiRenderTargetVizCtrl --- Implementation of guiRenderTargetVizCtrl which allows you to feed a render target and have it display.    Also added a gui to the editor that can open a window and has a drop-down selection of named targets that can be viewed.,feature,feature,0,0
"""multilabel classification: Eliminate socket filters on message queues --- The message queue filter code is a bit slow, and should be removed.  The only consumer of this at present is the old SUB framework, which could use it's own internal code to do subscription filtering.  This would let us remove this lock and save overall performance for the vast majority of use cases.""",performance,performance,1,1
multilabel classification: Issues with deploying app on AWS - No Solution Stack named '64bit Amazon Linux 2015.03 v1.4.1 running Tomcat 8 Java 8' found --- ,bug,bug,0,0
multilabel classification: Build in Jenkins failing with or without root (npm VS docker) --- ,bug,bug,0,0
"""multilabel classification: Guess current timezone --- This adds the ability to guess the browser's timezone. See #138. ### Demo  http://jsfiddle.net/bvjxt7jr/11/ ### Implementation  The implementation is fairly similar to [jstimezonedetect](https://github.com/HenningM/jstimezonedetect). We look through a whitelist of zones and check if the offset matches in both January and June.  There are about 500 different timezone identifiers, and about 60 unique January/June offset pairs in use this year. [The limitations of jstimezonedetect](https://github.com/HenningM/jstimezonedetect#limitations) also apply here. We don't differentiate between `Europe/Berlin` and `Europe/Stockholm` as they are equivalent in recent years. ### Whitelisted names  These are the whitelisted timezone names for each January/June offset pair.  | Jan | Jul | Timezone Name | | --- | --- | --- | | -11:00 | -11:00 | Pacific/Pago_Pago | | -10:00 | -10:00 | Pacific/Honolulu | | -10:00 | -09:00 | America/Adak | | -09:30 | -09:30 | Pacific/Marquesas | | -09:00 | -09:00 | Pacific""",feature,feature,0,0
multilabel classification: Make routing time-dependent --- Related to #831     Currently only the public transit routing is really time-dependent.     Traffic data integration and CH road routing are not the goals of this issue.,feature,feature,0,0
multilabel classification: Adds the ability to define types of assets to be auto-loaded --- Adds the ability to define types of assets to be auto-loaded when the module is initialized.,feature,feature,0,0
"""multilabel classification: Retrieving stats when running with --no-web --- What is the recommended way of retrieving stats from locust when running with '--no-web'?   I am currently running a load test programmatically and with the web interface disabled, I am unable to poll stats/requests/csv while the test is running.  I tried using the log file with '--print-stats' but the stats are not printed to the log.  Thanks!  """,feature,performance,1,0
multilabel classification: Entity Resource Test - Bug when an entity is created with a Blob attribute --- ,bug,bug,0,0
multilabel classification: Test suite failed to run. Your test suite must contain at least one test. --- ,bug,bug,0,0
multilabel classification: Creating an entity called Document when using mongodb leads to broken Application --- ,bug,bug,0,0
multilabel classification: Initial implementation of the EditorTool class and world editor hook-in. --- ,feature,feature,0,0
multilabel classification: Cannot open entity page for generated entities including a field with type enum --- ,bug,bug,0,0
multilabel classification: faster object instantiation --- Hi !  Is Mongoengine performing any data integrity check on load/read ? While data integrity is important to me on write it is a lot less on read  Asking because the model instantiation can be a bit slow and not sure what is causing it. ,performance,performance,1,1
multilabel classification: Detail page is weird since .dl-horizontal has been replaced by .row --- ,bug,bug,0,0
"""multilabel classification: ClientPackageManager is set to npm in jdl, but jhipster sets yarn in angular.json --- """,bug,bug,0,0
multilabel classification: Adds gui3DProjectionCtrl --- Adds gui3DProjectionCtrl so a gui control can be tracked to a point in 3d space,feature,feature,0,0
"""multilabel classification: Refactored OSM Shapefile importer --- Fixes / changes completed    1. Highway tag – we’re now using this (not used before, previously the code was using a hardcoded speed or max speed if non-zero).    1. Max speed tag now passed properly to the encoders. Added a filter for value “0” as in Geofabrik shapefiles 0 means no tag, but 0 will probably just mean 0 speed in the Graphhopper flag encoders…    1. One way tags now used properly. Previously the code was only checking for “0” and treating this as boolean. You also have to check for against the direction of digitisation (e.g. value “-1” if its one-way against the directory of digitisation). Also Geofabrik is using an odd (unfortunately non-standard) convention for their shapefile oneway field; I now read this convention but turn into the standard convention in the ReaderWay I pass to the flag encoders. This could break in the future if Geofabrik clean this up (the code will throw an exception with a useful message if it breaks).    1. Encoding manager now used properly. I""",feature,feature,0,0
"""multilabel classification: Limiting the number of completions to return --- There are some huge python libraries like `wx` (`brew install wxpython`) with ~4K objects in the root of the module.        This requires 3GB of RAM to run and a lot of time, with twice more time with dry cache.    How could we deal with such libraries? This would hung any completion provider. My first thought would be to return generator on `.completions()` call instead of precomputing all possible completions, so we could ignore some objects if there's too many of them.""",performance,performance,1,1
multilabel classification: Angular: user management page bugged when trying to CRUD --- ,bug,bug,0,0
multilabel classification: Expected spy to have been called but it was not called in jest test framework   --- ,bug,bug,0,0
"""multilabel classification: On session expired , Login modal window does not open --- """,bug,bug,0,0
"""multilabel classification: New feature: additional close button --- Please, add cross button option in top right button. """,feature,feature,0,0
multilabel classification: Initial schema creation error when using OAuth2 with Oracle DB --- ,bug,bug,0,0
"""multilabel classification: Use a dedicated TestResult object instead of keeping ConjectureData around --- The main motivation for doing this was memory usage, but I think it actually makes the API much cleaner to have a logical distinction between its data and its result, and it's something I've vaguely felt I should do for a while but never got around to.""",performance,feature,0,1
multilabel classification: Improve performances of the task queue. --- Ensure no new properties are added. Don't use the delete operator. According to previous discussions. ,performance,performance,1,1
multilabel classification: java 7 compilation fails since HikariCP-java6 version 2.4.0 is not in maven repo --- ,bug,bug,0,0
multilabel classification: Add init size for NEWARR opcode (array literal) --- Similar to NEWOBJ init size.    - [x] Add NEWARR init size to compiler  - [x] Add NEWARR init size to executor  - [x] Debugger opcode metadata  - [x] Testcase coverage  - [x] Perf tests  - [x] Releases entry,performance,feature,0,1
multilabel classification: jhipster:entity error if translation vietnamese - _entity_vi.json not found --- ,bug,bug,0,0
multilabel classification: Cannot set negative values for numeric fields of entities --- ,bug,bug,0,0
"""multilabel classification: Adds the RotationF utility math class. --- The class is designed as a general-purpose rotation/orientation class to make it easy to work with rotations and swap between math types as easily as possible.  Cleaned up second go at this, with some reorginizations and fixes. """,feature,feature,0,0
"""multilabel classification: Don't rewrite novel buffers --- Another oh this is one of the the allocation hotspots and there's no good reason for it to be PR which is unlikely to have a huge impact in and of its own right but is small enough that it's worth doing anyway.    When we look up a buffer we rewrite it to see if it corresponds to something we've previously run, but if there's a novel behaviour then we definitely *haven't* run it before, so there's no point in rewriting it. When the buffer is large, doing so can involve a bunch of useless allocations.""",performance,performance,1,1
multilabel classification: Generated entity service name could clash with JHipster service name  --- ,bug,bug,0,0
multilabel classification: Classes that implements Serializable would be nice to have serialVersionUID --- ,bug,feature,0,0
multilabel classification: Mapstruct Implementation assumes that all related entity has a DTO --- ,bug,bug,0,0
multilabel classification: Error when creating many to one entity and trying to choose.  --- ,bug,bug,0,0
multilabel classification: TypeError: Cannot assign to read only property 'Symbol(Symbol.toStringTag)' of object '#<process>' --- ,bug,bug,0,0
multilabel classification: Documentation is unclear on how to handle global variables --- ,bug,documentation,0,0
"""multilabel classification: Add JSON.stringify() fast path for plain buffers --- Virtual index keys are enumerable, so result is e.g. `{0:123,1:10}`.""",performance,feature,0,1
multilabel classification: Add car4wd routing profile --- Allow routing through tracks regardless of their tracktype value. Including support for block_fords and block_barriers config settings. ,feature,feature,0,0
multilabel classification: Very slow PAIR performance compared to nanomsg --- Throughput performance measured with embedded local_thr and remote_thr show 40 times slower performance compared to nanomsg!   nanomsg: > 600.000 msg/sec  nng:         15.000 msg/sec,performance,performance,1,1
multilabel classification: [Feature] Create Angular.js directive --- Is is possible for one to create an Angular.js plugin for this one? ,feature,feature,0,0
"""multilabel classification: Don't bother calculating the giant table of masks that we never use --- See title.    Usage of this field went away in #1846 but the field itself did not. The field itself is potentially quite big, and updating it potentially happens quite often (in my Csmith experiments all `draw_bits` calls are with `n_bits=31`. So this was getting populated on every single call. This was a poor life choice)""",performance,performance,1,1
multilabel classification: Jest 23: Spy on Date.now breaks done() in async tests --- ,bug,bug,0,0
"""multilabel classification: Optimize duk_propdesc filling when property not found --- When looking for a property through the inheritance chain, current code first fills in not found values to the output `duk_propdesc` and then modifies only the necessary fields, e.g. setting e_idx and flags. This happens even when the property is not found, and is done for every level of the inheritance chain check.    Change the code to fill in the `duk_propdesc` only when the property is found. Don't fill in anything if the property is not found, the return code of the lookup is enough for the caller to ignore any values in the struct.    Tasks:  - [x] Rebase  - [x] Check call sites to ensure they respect propdesc lookup return value  - [x] Use explicit return value for find existing entry, fix call sites  - [x] Perf test  - [x] Manual assert test run  - [x] Releases entry""",performance,performance,1,1
multilabel classification: entity sub-generator: invalid dependency between --regenerate and --table-name for entities with reserved words as names --- ,bug,bug,0,0
"""multilabel classification: message queue put_error unused --- The nni_msgq_set_put_error and the nni_msgq_set_error apis are unused.  (The nni_msgq_set_get_error API is still used by the surveyor pattern -- which is something we should fix.)    We should eliminate that code -- using it requires holding locks across longer code flows, including conditional branches which are painful.    This is legacy from when we used the message queue for everything -- these days many patterns simply bypass the upper message queue.""",performance,performance,1,1
"""multilabel classification: Isochrones for public transit --- Like this:    http://localhost:5000/isochrone?point=45.5176544,-122.6781463&pt.earliest_departure_time=2018-07-03T18:43:04Z&time_limit=1200    <img width=758 alt=screen shot 2018-07-03 at 16 18 57 src=https://user-images.githubusercontent.com/520916/42225647-524eb54a-7edd-11e8-9a58-6bc462407d20.png>  """,feature,feature,0,0
multilabel classification: upgrade force option does not work on jhipster modules --- ,bug,bug,0,0
multilabel classification: Jest can't find babel plugin that is installed and exists --- ,bug,bug,0,0
multilabel classification: Regression: Generating a TextBlob creates a file upload field in 4.3.0 --- ,bug,bug,0,0
multilabel classification: nni_aio_set_synch() usually doesn't do anything --- The code for a normal completion (other than timeout) when nni_aio_set_synch() has been called does not actually cause the nni_aio_finish() code to complete the request synchronously.  This potentially leaves a lot of performance on the table.,performance,performance,1,1
multilabel classification: Allow the option to run a single Locust through the UI --- I would like to be able to choose which Locust to run through the UI. This would make it very easy to support having a large corpus of tests and have the option to only run a single one when it suits the user.     The core of this feature relies on the Locust class's `__name__` property. The `LocustRunner` holds a dict of `class.__name__` to `class` in `locust_classes_by_name` and provides a method to building that dict and a way of picking one with `filter_locusts_by_name`.    Right now this only supports running a single Locust or all of them. The web UI has a select that defaults to All:    ![image](https://user-images.githubusercontent.com/2565265/33097052-f373ee02-ced6-11e7-90cc-92c7ab5abc79.png)    And has a list of Locusts to run:    ![image](https://user-images.githubusercontent.com/2565265/33097105-0dfca764-ced7-11e7-8b03-b402f19a1c67.png)    The URL `/swarm` accepts `locust_class` in the POST body but defaults it to `all`. `all` in this case will be converted to `None` when p,feature,feature,0,0
"""multilabel classification: Support 'height', 'weight', 'width' road attributes --- Unrecognized values will be logged and ignored.""",feature,feature,0,0
"""multilabel classification: Restore originally requested URL using all HTTP methods: POST, HEAD... and not only GET --- """,feature,feature,0,0
multilabel classification: Adds ability to skip loading of cached dts in enumColladaForImport --- ,feature,feature,0,0
multilabel classification: Duplicate function track<Entity>ById when 2 relations with same entity --- ,bug,bug,0,0
multilabel classification: Check whether inline parsing can be speed up by using strpbrk() --- http://www.php.net/manual/en/function.strpbrk.php  other useful functions: - http://www.php.net/manual/en/function.strspn.php - http://www.php.net/manual/en/function.strstr.php - http://www.php.net/manual/en/function.strtok.php ,performance,performance,1,1
"""multilabel classification: Performance between rapidjson.FindMember and unordered_map find --- HI guys,    I meet one problem in my project when I try to substitute unordered_map.find with rapidjson.FindMember, the performance seems to be much worse. I am not sure why, dost FindMember with O(1) which I thought, so it seems to be same between FindMember and unordered_map?  Or is that related with key type, while unorderd_map uses integer and rapidjson uses string?    Thanks a lot""",performance,performance,1,1
"""multilabel classification: Move large and rare opcodes into NOINLINE helpers --- Move handling of the following opcodes into NOINLINE helpers to make the main dispatch function smaller and a bit better performing:    - INITSET and INITGET  - TRYCATCH  - ENDTRY  - ENDCATCH  - ENDFIN  - INITENUM and NEXTENUM    There are more potential opcodes for similar treatment, but these are quite clear cases.    Tasks:  - [x] Move opcodes to helpers  - [x] Check if a conditional NOINLINE improves footprint  - [x] Releases entry""",performance,performance,1,1
multilabel classification: Remove lingering Block allocation --- Turns out that as well as lazily allocating `Block` objects as of #1830 we're *also* allocating them on the hot path. 🙄 This removes that code.    I think this must have got screwed up in a rebase as I had a bunch of branches in flight at the time.,performance,feature,0,1
multilabel classification: Can't resolve modules which in sub node_modules after upgrade to 24.1.0 from 23.x --- ,bug,bug,0,0
multilabel classification: ESLint Angular JS issue with the latest Eslint version --- ,bug,bug,0,0
multilabel classification: Block area and roads per request --- We need a built-in functionality for the [forbiddenEdgeId-Weighting](https://github.com/graphhopper/graphhopper/blob/master/docs/core/weighting.md) to block an area or a list of lookups.    Currently this is only possible as a post processing step before the routing via the [overlay mechanism](https://github.com/graphhopper/graphhopper/pull/781)  ,feature,feature,0,0
"""multilabel classification: Maximize priority of nextTick --- Unroll ticks regardless of platform.  Use the highest priority event queue avaliable on each platform.  This should also address issues with Node's newly non-recursive nextTick.  #259.  Seems to have a problem with domains on NodeJS 0.8, but not 0.6 or 0.10. https://travis-ci.org/kriskowal/q/jobs/6231967  Needs cross browser testing. """,performance,performance,1,1
"""multilabel classification: grouping requests after redirect --- #228 asked a similar question, but I don't think it handles the use case where a request redirects.    I don't know what the redirect will look like in advance, so I can't skip it. But I'd like to group all those requests under one path, because the trailing segments are different for every locust. Adding `name=/fubar/` to the initial request didn't seem to do this. Is there another way?   Operationally, I think it would make sense to configure the client in `on_start` so that all requests matching some pattern will be reported as `/fubar/baz`. """,feature,feature,0,0
"""multilabel classification: [performance] Seq / LazySeq removeValue needs optimized --- Currently uses a Stream based optimization which is very slow.  Causes a knock on effect when using mergeMap with a max concurrency level above 1 (as each ActiveSubscriber completing involves a stream removal and Seq recreation),""",performance,performance,1,1
"""multilabel classification: 增加 strict 参数来控制处理声母和韵母时是否严格遵循《汉语拼音方案》标准 --- 为了兼容旧版，目前默认  `strict=True`    当 `strict=True` 时根据 [《汉语拼音方案》](http://www.moe.edu.cn/s78/A19/yxs_left/moe_810/s230/195802/t19580201_186000.html) 的如下规则处理声母、在韵母相关风格下还原正确的韵母：    >    * 21 个声母：b 	p 	m 	f 		d 	t 	n 	l g 	k 	h 			j 	q 	x zh 	ch 	sh 	r 		z 	c 	s （**y，w 不是声母**）  >    * i行的韵母，前面没有声母的时候，写成yi(衣)，ya(呀)，ye(耶)，yao(腰)，you(忧)，yan(烟)，yin(因)，yang(央)，ying(英)，yong(雍)。         （**y 不是声母**）  >    * u行的韵母，前面没有声母的时候，写成wu(乌)，wa(蛙)，wo(窝)，wai(歪)，wei(威)，wan(弯)，wen(温)，wang(汪)，weng(翁)。        （**w 不是声母**）  >    * ü行的韵母，前面没有声母的时候，写成yu(迂)，yue(约)，yuan(冤)，yun(晕)；ü上两点省略。         （**韵母相关风格下还原正确的韵母 ü**）  >    * ü行的韵跟声母j，q，x拼的时候，写成ju(居)，qu(区)，xu(虚)，ü上两点也省略；           但是跟声母n，l拼的时候，仍然写成nü(女)，lü(吕)。          （**韵母相关风格下还原正确的韵母 ü**）  > * iou，uei，uen前面加声母的时候，写成iu，ui，un。例如niu(牛)，gui(归)，lun(论)。        （**韵母相关风格下还原正确的韵母 iou，uei，uen**）    对于类似 https://github.com/mozillazg/python-pinyin/issues/64 https://github.com/mozillazg/python-pinyin/issues/27 的问题，如果想要把 `y, w` 当作声母或者不在乎原始的韵母是什么，可以在调用相关函数时传入关键字参数 `strict=False` 即可。""",feature,feature,0,0
multilabel classification: Allow CasClient to use custom parameters when building callback urls --- ,feature,feature,0,0
multilabel classification: Can't  install other generators from the JHipster Marketplace + blank page for client project  --- ,bug,bug,0,0
"""multilabel classification: Provide type short name function --- `@JSONType` is configured on the class name, but this invades the domain, is there a way to configure it on Config Class?    Form a form like `Config.register(Class clazz, String shortName)`.    When serializing and deserializing, fastjson can match according to the configured short name.""",feature,feature,0,0
"""multilabel classification: Multiple, irrelevant GET Requests on elastic search with an infinite scroll. --- """,bug,bug,0,0
"""multilabel classification: Pub/Sub very slow compared with nanomsg --- ## NNG & Platform details.  nng version 1.0.1 - Fedora 28 - C++    I used the pub/sub pattern and measured peak message throughput of 35k messages per second with an average of 20k messages per second. Using exactly the same code, only replacing the nng specific code with nanomsg I get about 1M messages per second which is not brilliant either but I have made no attempts at optimization so that's fine.    I was very surprised by the difference in performance, am I missing something obvious here?    P.S. I just used the code from the examples both for nanomsg and nng.  """,performance,performance,1,1
multilabel classification: Allow the option to run a single Locust through the UI --- I would like to be able to choose which Locust to run through the UI. This would make it very easy to support having a large corpus of tests and have the option to only run a single one when it suits the user.     The core of this feature relies on the Locust class's `__name__` property. The `LocustRunner` holds a dict of `class.__name__` to `class` in `locust_classes_by_name` and provides a method to building that dict and a way of picking one with `filter_locusts_by_name`.    Right now this only supports running a single Locust or all of them. The web UI has a select that defaults to All:    ![image](https://user-images.githubusercontent.com/2565265/33097052-f373ee02-ced6-11e7-90cc-92c7ab5abc79.png)    And has a list of Locusts to run:    ![image](https://user-images.githubusercontent.com/2565265/33097105-0dfca764-ced7-11e7-8b03-b402f19a1c67.png)    The URL `/swarm` accepts `locust_class` in the POST body but defaults it to `all`. `all` in this case will be converted to `None` when p,feature,feature,0,0
"""multilabel classification: Basic OpenVR Support code --- Adds basic OpenVR support. This also includes support for rendering controllers based on OpenVR data, though this is as of yet incomplete as there are no hooks for the button input.  Much like the oculus support, a script is also provided to handle setting up control input. However this is not hooked in by default for this PR.  The intention of this PR is more to add the support code to the engine and as a basis for identifying regressions with future dx11/gl changes. """,feature,feature,0,0
multilabel classification: Reloading an entity page causes the the menu item labels on the navbar to mysteriously change to attribute names --- ,bug,bug,0,0
multilabel classification: Gateway should not proxy to microservice when token is missing --- ,bug,bug,0,0
"""multilabel classification: Expose StubbingLookupListener publicly and create listener distinction --- Make StubbingLookupListener public. Originating ticket: #770    As a rule of a thumb we try to expose the internal APIs that the top level features are built upon. Since StubbingLookupListener is useful for us to implement strictness, let's get the former exposed as public API. This way we build stronger framework with the concept of onion skin API.""",feature,feature,0,0
multilabel classification: OAuth2 documentation is not generated anymore in the README.md since v5.6.0 --- ,bug,bug,0,0
