source,target,t5_label,t5,actual
"""multilabel classification: Add a best effort heap-wide object property slot cache --- Add a heap-wide property slot cache:  - Lookup key is a combination of `duk_hobject *` and a key string hash.  - Lookup value is a possible property slot (integer).    Property lookup changes:  - If object has hash part, use the hash part without using the slot cache.  - Otherwise, look up the slot cache using object/key.  - Validate the returned slot index: check that it's within the object's property table, and check that the key matches. If so, use the slot as is.  - Otherwise do the usual linear scan to find the key. When found, overwrite the property slot cache entry with the slot index.    The upsides of this approach are that:  - Unlike hash tables, it emphasizes actually looked up object/key pairs. No upfront work is done like with hash tables.  - There is no GC impact in ensuring the entries are valid (compare to the relatively tricky generation-based validity handling in the property cache prototype). The slot index is always just a best guess, and is always validated.  - The""",performance,feature,0,1
multilabel classification: Jest mockResolvedValue does not work with arrays in Typescript --- ,bug,bug,0,0
multilabel classification: Can't use babel-plugin-rewire with jest: The module factory of `jest.mock()` is not allowed to reference any out-of-scope variables --- ,bug,bug,0,0
multilabel classification: Introduce new getData method to avoid 64bit limit of getFlags --- Open questions     - int getData(int index) or maybe byte getData(int index) or `ByteRef getData(int index)` like lucene does similar? `int getData` would be easy to implement and not that bad.   - How to do this with #472   - Or should we implement a list of GraphExtension? This would allow more dynamically sized data and optional compression   - Or just a separate DataAccess nicely integrated in GHStorage    See something already in this branch https://github.com/graphhopper/graphhopper/compare/intsref_refactoring    Best would be if we can avoid getData method and use higher level methods instead.    ~~getFlags would be still necessary as it is the only 'column' where reversing is applied (#728)~~    Not part of this issue is to change the data type `long` to `byte[]` in the OSMReader IMO.,feature,feature,0,0
"""multilabel classification: Add internal duk_concat_2() helper for str+str arithmetic --- - [x] Add internal duk_concat_2() helper  - [x] Use it for executor str+str arithmetic, remove unnecessary ToString() in the call site (concat does it)  - [x] Add perf test  - [x] Releases entry""",performance,feature,0,1
"""multilabel classification: Test """"isVisible() rendering bypass"""" Performance --- As I was cutting jQuery out of the library (#62) I came across an interesting [article](http://stackoverflow.com/questions/19669786/check-if-element-is-visible-in-dom) on StackOverflow that lead me to this [jsperf](http://jsperf.com/check-hidden) showing that depending on how you check visibility there can be some serious performance consequences.  Let's build a test on http://jsperf.com/ to see just how much performance you gain having to check for visibility each frame. Specifically we should test the following: 1. Visible container rendering with check 2. Visible container rendering without check 3. Invisible container rendering with check """,performance,performance,1,1
"""multilabel classification: jdl creates """"many-side"""" in both entities for relationship manyToOne --- """,bug,bug,0,0
multilabel classification: Default microservice stack doesnt work out of the box --- ,bug,bug,0,0
multilabel classification: Bug: Entity dialog submit button is not re enabled on error --- ,bug,bug,0,0
"""multilabel classification: cached_test_function should not execute test function when it would overrun --- As @Zalathar pointed out in #1540 (and is now commented), currently `cached_test_function` will re-execute the test function in some cases where it knows that it cannot work because it's a strict prefix of a previously evaluated test.    In these cases it should avoid that re-execution and should instead return a fake `ConjectureData` object of some sort that indicates it overran.    (In theory it could synthesise a picture perfect accurate one with all the right data, but I don't think we actually need to do that - it's probably better if it's *not* a real ConjectureData object and errors if you try to do anything other than access its status and buffer)""",performance,performance,1,1
"""multilabel classification: JHipster 4.0.7 with Gradle+Kafka fails with """"object is not an instance of declaring class"""" --- """,bug,bug,0,0
multilabel classification: spyOn getter requires explicit type on getter after Jest 24 --- ,bug,bug,0,0
"""multilabel classification: Don't store the entire ConjectureData object in the tree --- This limits the scope of the `DataTree` to only store enough information to recreate the buffer and status of the stored `ConjectureData` objects. We then use a standard cache to map the rewritten buffers to the generated `ConjectureData` objects so that the shrinker still has access to them during shrinking, but eviction is now possible.    The reasoning is that `ConjectureData` objects are really large and memory hungry, and for the overwhelming majority of our tree usage we don't actually need them, so by avoiding storing them for that we can significantly reduce the memory profile.""",performance,performance,1,1
"""multilabel classification: Sometimes can't generate without prompt, even if there is file .yo-rc.json and other generation problems --- """,bug,performance,1,0
multilabel classification: root user in Jenkinsfile prevent jenkins to execute commands --- ,bug,bug,0,0
"""multilabel classification: Add DUK_HOBJECT_FLAG_FASTREFS to duk_hobject --- Refzero and mark-and-sweep need to DECREF/mark all actual strong references held by a duk_hobject. Because there are multiple duk_hobject sub-struct the DECREF/marking code needs to check multiple bits to see which sub-struct is used. Because most garbage collected objects are plain objects and arrays, and they don't have a sub-struct, several unnecessary bit tests are made for them.    Add `DUK_HOBJECT_FLAG_FASTREFS` which indicates that the object either (a) doesn't have a sub-struct, or (b) has a sub-struct but there are no strong references needing a DECREF/marking in the sub-struct. When the flag is set, DECREF/mark code can quickly skip testing the other flags.    As a technical side effect `Duktape.Thread.prototype` is changed to have an internal class of Object rather than Thread. This is needed due to flag changes; a `duk_hthread` is now recognized by its internal class rather than `DUK_HOBJECT_FLAG_THREAD` so whenever an object's inner class is Thread, Duktape internals assum""",performance,feature,0,1
"""multilabel classification: Also calculate blocks lazily --- Hey, psst, buddy, would you like to see some really weird code? Then boy do I have the PR for you.    Following on from #1828 where we calculated `examples` on first use, this also allows us to calculate `Block` objects on first usage.    Unfortunately the big differences between `Example` and `Block` are that a) We use blocks a lot more and b) We need them during generation time. This means that the `Example` approach of just deferring until we first access the collection is a non-starter.    So this does uh something else. The basic idea is that we can create a collection that only _looks_ like a list of blocks but actually only stores the endpoints until we first ask it for each block object.    Important features:    * If we only ask for a small number of blocks then we only build a small number of blocks. e.g. stateful testing asks for the last block generated (due to slightly dodgy reasons), and doing that should not cause all blocks to be calculated.  * A lot of things that coul""",performance,feature,0,1
"""multilabel classification: collection itemFilter should prevent filtered item markup from rendering --- Currently, using itemFilter will simple hide item level markup.  This can cause a problem if that item level data contains form fields which should not be retrieved when serialize is called. """,performance,performance,1,1
"""multilabel classification: Volumetric Fog with corrections --- Based on the Winterleaf PR #1059, this adds corrections so that it works with HDR being active, and also utilizes ambient color so that it works with day/night cycles, rather than being unlit during low-light settings. """,feature,feature,0,0
multilabel classification: Minification for prod skips js files in custom folders sometimes --- ,bug,bug,0,0
"""multilabel classification: Slow pandas completion --- I'm getting significant lag in emacs (company-mode with anaconda backend), while completions seem to break entirely with vim (YouCompleteMe) where it won't complete anything anymore for a long, long time when using pandas 0.15.1. Here is some example code:    It is at this point where lag in emacs becomes unbearable, while vim will happily continue to work, but all completions from YouCompleteMe will not work anymore (including completions for a different library).  Now, it seems the issue is that the getting the completion candidates is a costly affair in jedi itself:    Which gives me:    A similar timeit operation on os.path. completion gives me 9 ms, so it seems to me like that might be the source of the problem. """,performance,performance,1,1
"""multilabel classification: Performance degradation from 3.30.0 to 3.66.1 due to many """"invalid examples"""" --- Hi all,    I wrote a strategy for generating NetworkX graphs (https://github.com/pckroon/hypothesis-networkx), but testing that code is super slow. Previous issues here made me look at some older versions of hypothesis, and 3.30.0 in particular. It seems that the current version produces many many more invalid examples for some reason. Here's the statistics for both versions I tried:    For 3.66.1:      And for 3.30.0:  """,performance,performance,1,1
"""multilabel classification: >2 second lag in some cases using python 3 --- Forgive me if this is a known issue, I couldn't find it listed in the backlog.  I just started using Jedi with Vim to help edit python 3 scripts.  It works ok so far, but occasionally it locks up for sometimes as long as 2 seconds after triggering completion.  I tried looking into it briefly myself and turned on `jedi#enable_speed_debugging`, which resulted in this output:  https://dl.dropboxusercontent.com/u/2959315/temp/error_output.png  Which seems to point to some imports like datetime taking quite a long time """,performance,performance,1,1
"""multilabel classification: Expanded mesh baking functionality --- Expanded mesh baking functionality, now supporting baking of LODs and Collision meshes""",feature,feature,0,0
"""multilabel classification: Jedi on sublimeText3 too slow. --- When I typing code. It's very lagging...  For example:  content = res.content.decode('utf-8')  When I typing these code, on first c its lag..  res. its lag..  How to fix it ???  not a large file.  Look when i typing res.   ![jedi_lag](https://user-images.githubusercontent.com/40101424/48302838-d2aaaf80-e53c-11e8-9fd4-52ab08efd680.gif)  """,performance,performance,1,1
multilabel classification: Consider dropping expand-token attribute support for subexpressions --- I.e.  `{{i18n (expand foo{{bar}})}}` vs. `{{i18n foo{{bar}} expand-token=true}}`  Pros: More explicit when there may be security concerns. Cons: Subexpressions are a bit slower than just executing one helper. As of right now they can't be resolved via `trackIds`. ,performance,feature,0,1
multilabel classification: [Feature Request] Large world support --- Would it be possible to get large world support in the main branch of T3D?    Here is what I mean by that -   1. Terrain paging via [Terrain Master](https://github.com/ChrisCalef/T3DTerrainMaster)  2. Origin Shifting Via PhysX - http://docs.nvidia.com/gameworks/content/gameworkslibrary/physx/guide/Manual/OriginShift.html   3. Expose Origin shifting as a component    Since we already use PhysX This is part of the issue solved. However It would be dependent on getting physx 3.4.0 into the engine. I know that @rextimmy has a PR for that though. https://github.com/GarageGames/Torque3D/pull/2186,feature,feature,0,0
"""multilabel classification: Need PATRICIA trie for SUB --- When faced with very many subscriptions, we wind up doing a very poor filter of the topics, which can be O(n * k), which is not good.  Patricia is O(k).    We can steal the code from libnanomsg (though we will need to adapt it.)""",performance,feature,0,1
multilabel classification: Entity links to the User entity do not work --- ,bug,bug,0,0
"""multilabel classification: Implements hold and context keybinds --- Implements hold and context keybind functionality, enabling the ability to have actionmap binds for holding down a button(complete with hold time return if needed) and context binds for being able to have different events for tapping and holding on the same key.""",feature,feature,0,0
multilabel classification: Self referenced entities generated using JDL import error on Angular 4 --- ,bug,bug,0,0
"""multilabel classification: Provide support for Windows formatted timezones --- I'm trying to use moment to create a calendar ics file with the appropriate timezone, but since moment uses IANA timezone format and Outlook doesn't, i'm needing to find some way of converting the IANA name to windows so it recognizes the timezone name. It would be great if you had some function to get the Windows-compatible timezone name. Not like i'm in love with windows or anything, but everyone seems to have outlook.  Thanks! """,feature,feature,0,0
"""multilabel classification: Improve location lookup to avoid geocoding mismatch --- As mentioned in #549 I am currently looking into improving the location lookup. So what I did, was to extend the LocationIndex Interface for a new method, that matches not necessarily the closest but the best match, by comparing not only geographic distance but also the Levenstein distance.  Right now this is really simplistic and only a brief draft of how this could look like. As usual I like to discuss a draft first, before implementing too much detail :). However, the shown implementation matches the correct Street, for the example in #549, see the new IT.  So things that need to be done: - [x] Implement the `point_hint` parameter - also decide about the design of this parameter. - [x] Implement a more sophisticated 'Good Match', for example if the name is 5% of the perfect match. But then we would have to check if the distance from the best match from the current closestMatch is smaller than from the current. Not sure if this is worth the trouble? - [x] Prepare strings before compa""",feature,feature,0,0
multilabel classification: JHipster 2.18 - Swagger Docs V2 - Unauthorized with Oauth2 --- ,bug,bug,0,0
"""multilabel classification: Ai turret ignore list functions --- Implements feature(s) requested in issue #1272   The first feature is exposing a function to Torquescript that allows retrieving the count of the total number of objects on a turret's ai ignore list, ignoreListCount().    The second feature is exposing a function to Torquescript that allows retrieving a reference to an object on an AI turret's ignore list based off of the index in the list of that object, rather than the object's ID (so the object's ID does not have to be known beforehand).  The feature request issue #1272 requests for this feature to return the object's ID but then shows an example modifying the object directly (increasing the health of the object by 10), so to fulfill the requested functionality based on the example, this feature returns a reference to the object itself so that properties can be called and modified on the object directly, as shown in the example on the feature request.""",feature,feature,0,0
multilabel classification: Error when entity have a attribute enumeration (enum java). --- ,bug,bug,0,0
multilabel classification: Watch usages would be more intuitive if they were not case sensitive. --- ,bug,feature,0,0
"""multilabel classification: Add cancelButtonColor option --- It would be nice to have a `cancelButtonColor` option, similar to `confirmButtonColor`. """,feature,feature,0,0
"""multilabel classification: Component created using React.memo appears as """"Component"""" in snapshot --- """,bug,bug,0,0
multilabel classification: setDocumentRoot should not be called when running .war with java -jar --- ,bug,bug,0,0
multilabel classification: Add distance path detail --- We already have time and to avoid client side distance calculation we could easily offer this,feature,feature,0,0
"""multilabel classification: Don't calculate exception lists until we first need them. --- It turns out that importing `pytest` is surprisingly slow, to the point that it shows up as a significant cost when running Hypothesis under a profiler.    This PR changes our imports that we use to determine skip and failure exceptions to only happen when we first catch an exception. We still have to pay the cost (if you're not using the internal API, which I am), but this makes the initial import a lot faster, which can also be relevant for interactive usage.""",performance,performance,1,1
"""multilabel classification: Reverse property read entry vs. array part check order --- Because almost all array part reads go through the fast path, check the entry part first (previously array part was checked first) which is slightly faster. A property never exists in both parts at the same time, so the check order has no functional importance.""",performance,performance,1,1
multilabel classification: Executing the WAR file without an application server wont work with hazelcast --- ,bug,bug,0,0
multilabel classification: NPE executing liquibase:diff if oauth2 is selected as authentication method --- ,bug,performance,1,0
multilabel classification: Bug in multiselect when using react and many-to-many relationship --- ,bug,bug,0,0
"""multilabel classification: Adds a new function for defining network-aware console fields on NetObjects --- Adds a new function for defining static console fields on NetObjects- addNetworkedField()    This lets you attach a 32 bit netMask to the field, so that when it is changed, it automatically flags the associated bitmasks on the netobject as dirty.    This is to shortcut having to flag certain masks being marked as dirty through protected fields and just simplify/streamline the code.""",feature,feature,0,0
multilabel classification: Get rid of closure reference to `resolvedPromise` in `defer` --- Some memory profiling reveals this to be a bit problematic.  We only really need it for `promise.inspect()` (and `promise.valueOf()`). The rest of the references could be replaced with a boolean. ,performance,feature,0,1
"""multilabel classification: Remove unnecessary check for hrule in parseListMarker --- By the time parseListMarker is called, the hrule block start was already tried. In case it matches, no further block starts are tried. So the later check is not necessary and can be removed.  Mirrors jgm/commonmark.js#19 """,performance,feature,0,1
multilabel classification: Windows: cannot run production build for a monolith app with version 5.8.2 --- ,bug,bug,0,0
"""multilabel classification: Add internal duk_hboundfunc type and collapse bound function chains --- Add a separate internal `duk_hboundfunc` type for faster bound function handling. Also collapse bound function chains on creation so that the target of a bound function is always a non-bound function directly.    - [x] Add duk_hboundfunc, changes in call handling etc to use it  - [x] Improve bound function call handling to allocate a gap and copy tvals there rather than using duk_dup() + duk_insert() which gets quite slow for large argument counts  - [x] Check for footprint improvements, follow-ups if necessary  - [x] Review and finalize changes  - [x] Testcase changes  - [x] Check dump/load handling for bound functions, add test coverage  - [x] Releases entry""",performance,performance,1,1
"""multilabel classification: JSON endpoint for dynamic speeds, blocking etc --- implement option 1 discussed [here](https://discuss.graphhopper.com/t/more-flexibility-in-gh/71/3)    """,feature,feature,0,0
multilabel classification: Unused import in e2e tests for entities with byte+text --- ,bug,bug,0,0
multilabel classification: Issue #713 part 1: store tunnel and bridge tags. --- This PR adds a few utility methods to check if the edge is a tunnel or a bridge edge. ,feature,feature,0,0
multilabel classification: `yarn check` prints out two warnings when installing the latest Jest 24.4.0 packages --- ,bug,bug,0,0
"""multilabel classification: Implement an initial version of property caching --- Implement an initial version of property caching where the property cache key is a (generation, object, key) triple. The cache is implemented in GETPROP (the most common property read operation) and the object in the triple is for the starting point of a property lookup. The generation count is a quick way of invalidating the whole cache on any property write or other operation risking cache integrity: entries can be invalidated by a single heap-level generation counter increment without touching the entries themselves. The generation is checked on a cache lookup; no hash chaining is used, and each property lookup hash has only a single slot.    So far this is pretty experimental and some invalidation cases are still missing. The goal is to try to figure out if the approach is workable given all the low level details. Quite possibly some small detail may prevent this from being finished as a viable feature.    Initial results are reasonable however:  - tests/perf/test-array-read-lenloo""",performance,feature,0,1
multilabel classification: Entity `update` integration tests are persisting changes to the test database immediately --- ,bug,bug,0,0
"""multilabel classification: Expect dies with """"ReferenceError: Element is not defined"""" in """"node"""" test environment --- """,bug,bug,0,0
multilabel classification: [feature request] Direct ray-subd intersection --- +1.   https://groups.google.com/forum/#!topic/opensubdiv/Ru5sHZD0gGo  It would be great if OpenSubdiv have efficient direct ray-patch intersector with spatial accelerator(e.g. BVH).  Efficient ray - patch intersector will be applicable for texturing purpose also: e.g. ptex texture painting on non-OpenGL environment.  ,feature,feature,0,0
multilabel classification: Keytool command used in generateKeyStore doesnt work in windows --- ,bug,bug,0,0
"""multilabel classification: Make logging timestamps etc optional --- For debug purposes, the logging ouput prepended with host, timestamp and so forth can make it difficult to parse the output. For example, pretty printing json files becomes a hard to read affair. A simple command line option should suffice. """,feature,feature,0,0
multilabel classification: AuditEventConverter throws NPE if AuditEvent is created with a key and no value for data --- ,bug,bug,0,0
"""multilabel classification: Separate engine into dynamic modules (.dll/.so/.dylib) --- Separate everything into separate modules. For example console, postFX, component, gui, etc., etc., to be in modules """,feature,feature,0,0
multilabel classification: Missed update in Elasticsearch after update user via service/UserService.updateUser --- ,bug,bug,0,0
multilabel classification: How do I change the favicon.ico from the spring leaf to my own figure? --- ,bug,feature,0,0
"""multilabel classification: Miscellaneous performance improvements --- Miscellaneous performance improvement issues to test:  - [ ] Use a 'regs' pointer in executor stack frame instead of on-the-fly thr->valstack_bottom lookup - #298  - [ ] Use a stack local `interrupt_counter` in executor, with handling similar to stack local `curr_pc`  - [ ] Add debug instrumentation for setjmp/longjmp counts, as these are important value to optimize with Emscripten  - [ ] Check relevance of bytecode dispatch switch handling for Emscripten performance  - [ ] Improve compiler handling of label sites: omit explicit label site if it won't be needed (useful for making iteration statements faster); perhaps optional because of compiler footprint  - [ ] Emscripten: use struct instead of union for duk_tval?  - [ ] Further DUK_TVAL_SET_xxx_UPDREF() tweaking, add fast variants to all macros, check call sites and use fast ones only in hot spots  - [ ] Direct tval push macro test in API  - [ ] JSON leftovers described in: https://github.com/svaarala/duktape/pull/445#issuecomment-15""",performance,performance,1,1
"""multilabel classification: jest ALWAYS runs all files, ignoring the --onlyChanged option --- """,bug,bug,0,0
